{
  "collection": "Summer",
  "set": {
    "name": "Fishing",
    "theme": "A lazy summer day of lake fishing: gear, bait and the one that got away.",
    "frame_color": "teal",
    "producer_notes": "New set not present in the current 16. Warm nostalgic mood, lots of turquoise and orange, no dead fish, keep it cute. Two gold cards.",
    "gold_count": 2
  },
  "generation": { "candidates_per_card": 4, "variants": 3, "aspect_ratio": "4:5", "image_size": "1K" },
  "cards": [
    { "id": 1, "name": "Bobber", "category": 1, "object": "A classic round fishing float, red top half and white bottom half with a small yellow stem, glossy plastic, floating diagonally with a short piece of line.", "bg_color": "turquoise", "bg_pattern": "radial light rays", "refs": ["data/cards/029_finals_honor_medal_c1.png", "data/cards/047_coolness_ice_pop_c1.png", "data/cards/073_boyscouts_jacket_c1.png"] },
    { "id": 2, "name": "Tackle Box", "category": 3, "object": "An open orange plastic tackle box with two fold-out trays holding big colorful lures and bobbers, chunky latch and handle.", "bg_color": "teal", "bg_pattern": "plain gradient", "surface": "weathered wooden dock planks", "props": "none", "refs": ["data/cards/043_coolness_ice_cubes_c3.png", "data/cards/067_seafaring_captain_hat_c3.png", "data/cards/026_finals_computer_c3.png"] },
    { "id": 3, "name": "Rod", "category": 2, "object": "A fishing rod with a cork handle and a big round reel, leaning upright at a slight angle, a bobber hanging from the line.", "bg_color": "sunny yellow", "bg_pattern": "vertical stripes", "surface": "matte yellow", "refs": ["data/cards/045_coolness_mojito_c2.png", "data/cards/037_amusement_chains_c2.png", "data/cards/030_finals_diploma_c2.png"] },
    { "id": 4, "name": "Bucket", "category": 3, "object": "A dented metal bucket full of water with two cheerful cartoon fish peeking out, a rope handle.", "bg_color": "sky blue", "bg_pattern": "concentric circles", "surface": "wet grey pebbles", "props": "none", "refs": ["data/cards/048_coolness_fruit_plate_c3.png", "data/cards/085_vacation_taxi_c3.png"] },
    { "id": 5, "name": "Lure", "category": 1, "object": "A big shiny fishing lure shaped like a little green-and-yellow fish with a cartoon eye and a silver spinner blade, hanging on a hook.", "bg_color": "coral orange", "bg_pattern": "repeating small fish icon pattern", "refs": ["data/cards/024_finals_calculator_c1.png", "data/cards/050_coolness_fan_fold_c1.png"] },
    { "id": 6, "name": "Camp Stool", "category": 2, "object": "A folding camp stool with a striped turquoise-and-white canvas seat and light wooden legs, a rolled-up fishing magazine on it.", "bg_color": "lavender", "bg_pattern": "plain gradient", "surface": "matte lavender", "refs": ["data/cards/042_coolness_vending_c2.png", "data/cards/001_gardens_flower_arch_c2.png"] },
    { "id": 7, "name": "Net", "category": 1, "object": "A landing net with a wooden handle and a turquoise mesh, a single round cartoon fish caught inside looking surprised.", "bg_color": "bright green", "bg_pattern": "wavy lines", "refs": ["data/cards/047_coolness_ice_pop_c1.png", "data/cards/021_finals_grad_cap_c1.png"] },
    { "id": 8, "name": "Boat", "category": 4, "object": "A small red-and-white wooden rowboat with two oars, tied to a wooden post, gently floating.", "bg_color": "deep blue", "environment": "calm lake at golden hour", "environment_details": "soft reeds, a wooden pier post, distant treeline, orange sunset reflection on the water", "props": "none", "refs": ["data/cards/049_coolness_pool_c4.png", "data/cards/098_beach_sunblock_c4.png", "data/cards/007_gardens_chess_table_c4.png"] },
    { "id": 9, "name": "Big Catch", "category": 5, "gold": true, "characters": ["man", "pig"], "scene": "The man proudly holds up a fishing rod bending under a huge catch, but on the hook is only an old rubber boot; the pig behind him applauds with genuine delight.", "object": "A fishing rod bent in an arc, an old brown rubber boot dripping water on the hook, a tackle box at their feet.", "bg_color": "turquoise", "environment": "wooden fishing pier on a lake", "environment_details": "turquoise water, wooden planks, reeds, a bright morning sky", "refs": ["data/cards/100_beach_beach_fun_c5_gold.png", "data/cards/128_road_trip_coffee_break_c5_gold.png", "data/cards/129_road_trip_packing_c5_gold.png"] },
    { "id": 10, "name": "Nap Time", "category": 5, "gold": true, "characters": ["rooster"], "scene": "The rooster has fallen asleep in a camp chair with the fishing rod between its feet, while a fish leaps out of the water right in front of it and steals the bait with a grin.", "object": "A striped camp chair, a fishing rod, a straw hat slipping over the rooster's eyes, a leaping cartoon fish with the bobber in its mouth.", "bg_color": "orange", "environment": "grassy lake shore at sunset", "environment_details": "orange sky, calm water with sun reflection, a few reeds", "refs": ["data/cards/099_beach_surfing_c5_gold.png", "data/cards/130_road_trip_hitchhike_c5_gold.png", "data/cards/160_summer_party_movie_night_c5_gold.png"] }
  ]
}
