{
  "collection": "Summer",
  "set": {
    "name": "Coolness",
    "theme": "Ways to stay cool in the summer heat. Remake of the existing set for an A/B comparison with the original cards 41-50.",
    "frame_color": "blue",
    "producer_notes": "Benchmark set: reproduce the original objects as closely as possible so the result can be compared side by side with data/cards/041-050.",
    "gold_count": 0
  },
  "generation": { "candidates_per_card": 4, "variants": 3, "aspect_ratio": "4:5", "image_size": "1K", "model": "gemini-3.1-flash-image" },
  "cards": [
    { "id": 1, "name": "Fan", "category": 4, "object": "A light-blue pedestal fan with a round silver wire cage, three wide sky-blue blades and a chrome pole, seen from the front and slightly above.", "bg_color": "warm orange", "environment": "cozy room corner", "environment_details": "an orange wall, a window with sky on the left, a long green curtain moving in the breeze", "props": "none", "refs": ["data/cards/041_coolness_fan_c4.png", "data/cards/049_coolness_pool_c4.png"] },
    { "id": 2, "name": "Vending", "category": 2, "object": "A chunky bright-blue vending machine with a glass front showing rows of colorful cans and bottles, a small screen and a silver pickup tray.", "bg_color": "magenta", "bg_pattern": "a plain soft gradient", "surface": "glossy magenta", "refs": ["data/cards/042_coolness_vending_c2.png", "data/cards/030_finals_diploma_c2.png", "data/cards/037_amusement_chains_c2.png"] },
    { "id": 3, "name": "Ice Cubes", "category": 3, "object": "A hot-pink silicone ice cube tray with four cells, three translucent frosty ice cubes inside and one cube popped out on top, frost crystals on the edges.", "bg_color": "sky blue", "bg_pattern": "radial light rays", "surface": "warm wooden table", "props": "none", "refs": ["data/cards/043_coolness_ice_cubes_c3.png", "data/cards/048_coolness_fruit_plate_c3.png", "data/cards/026_finals_computer_c3.png"] },
    { "id": 4, "name": "Aircon", "category": 3, "object": "A white wall-mounted air conditioner unit with a small house icon on the front, rounded edges, blowing visible pale-blue streams of cold air downwards.", "bg_color": "mint green", "bg_pattern": "vertical stripes wallpaper", "surface": "wall (unit mounted on the wall, room corner visible)", "props": "none", "refs": ["data/cards/044_coolness_aircon_c3.png", "data/cards/046_coolness_fresh_air_c3.png"] },
    { "id": 5, "name": "Mojito", "category": 2, "object": "A tall glass of pale-green mojito with big ice cubes, lime wedges, mint leaves on top and an orange bendy straw, condensation drops on the glass.", "bg_color": "royal blue", "bg_pattern": "concentric circles", "surface": "glossy blue", "refs": ["data/cards/045_coolness_mojito_c2.png", "data/cards/030_finals_diploma_c2.png"] },
    { "id": 6, "name": "Fresh Air", "category": 3, "object": "A white open double window built into a wall, both shutters swung outward, a bright lime-green curtain billowing out of the dark-blue interior.", "bg_color": "orange", "bg_pattern": "brick wall", "surface": "orange brick wall (window set into the wall)", "props": "none", "refs": ["data/cards/046_coolness_fresh_air_c3.png", "data/cards/044_coolness_aircon_c3.png"] },
    { "id": 7, "name": "Ice Pop", "category": 1, "object": "A raspberry-red popsicle on a wooden stick, two grooves along its body, frosty crystals and melting drops, tilted diagonally.", "bg_color": "bright green", "bg_pattern": "radial light rays", "refs": ["data/cards/047_coolness_ice_pop_c1.png", "data/cards/029_finals_honor_medal_c1.png", "data/cards/073_boyscouts_jacket_c1.png"] },
    { "id": 8, "name": "Fruit Plate", "category": 3, "object": "A round glass plate with a big watermelon slice, two orange wedges, a bunch of green grapes, strawberries and blueberries, water droplets on the fruit, seen from above at an angle.", "bg_color": "light wood", "bg_pattern": "plain wooden table top view", "surface": "light wooden table", "props": "none", "refs": ["data/cards/048_coolness_fruit_plate_c3.png", "data/cards/043_coolness_ice_cubes_c3.png"] },
    { "id": 9, "name": "Pool", "category": 4, "object": "A round inflatable kiddie pool with three rings in pink, yellow and blue, filled with water, a small yellow rubber duck floating in the middle.", "bg_color": "grass green", "environment": "backyard lawn", "environment_details": "bright green grass, a wooden fence behind", "props": "none", "refs": ["data/cards/049_coolness_pool_c4.png", "data/cards/007_gardens_chess_table_c4.png"] },
    { "id": 10, "name": "Fan Fold", "category": 1, "object": "An open purple folding hand fan with light wooden ribs, pleated paper, held open in a half circle, tilted.", "bg_color": "sunny yellow", "bg_pattern": "wavy lines", "refs": ["data/cards/050_coolness_fan_fold_c1.png", "data/cards/024_finals_calculator_c1.png", "data/cards/028_finals_clock_c1.png"] }
  ]
}
